{
  "checkpoint_after_steps": [
    0,
    1,
    2
  ],
  "clock": 11,
  "conditions": [
    {
      "condition_id": "room_check",
      "expected": "room_glassgrass_path",
      "kind": "room_id",
      "outcome": "win"
    }
  ],
  "format_version": 1,
  "intents": [
    {
      "quantity": 1,
      "target": "item_spark_lantern",
      "type": "take"
    },
    {
      "direction": "east",
      "type": "move"
    }
  ],
  "player_name": "Simulator",
  "seed": 7
}
